{
  "releases": [
    {
      "name": "MVP",
      "description": "The working notes product: auth, notes CRUD, pin, trash, folders",
      "provenance": "founder",
      "stories": 15
    },
    {
      "name": "Next",
      "description": "Findability and capture: search, photo and audio attachments",
      "provenance": "founder",
      "stories": 5
    },
    {
      "name": "Later",
      "description": "Shell and gallery demos around the product",
      "provenance": "founder",
      "stories": 8
    }
  ],
  "epics": [
    {
      "name": "Auth and accounts",
      "provenance": "founder",
      "features": [
        {
          "name": "Sign in",
          "stories": [
            {
              "name": "Sign in with email and OTP",
              "priority": "must",
              "release": "MVP",
              "provenance": "founder",
              "id": "auth-and-accounts.sign-in.sign-in-with-email-and-otp"
            },
            {
              "name": "Sign in with Google",
              "priority": "must",
              "release": "MVP",
              "provenance": "founder",
              "id": "auth-and-accounts.sign-in.sign-in-with-google"
            },
            {
              "name": "Sign in with Apple",
              "priority": "must",
              "release": "MVP",
              "provenance": "founder",
              "id": "auth-and-accounts.sign-in.sign-in-with-apple"
            },
            {
              "name": "Continue anonymously",
              "priority": "must",
              "release": "MVP",
              "provenance": "founder",
              "id": "auth-and-accounts.sign-in.continue-anonymously"
            }
          ],
          "id": "auth-and-accounts.sign-in"
        },
        {
          "name": "Create account",
          "stories": [
            {
              "name": "Create account with email and OTP",
              "priority": "must",
              "release": "MVP",
              "provenance": "founder",
              "id": "auth-and-accounts.create-account.create-account-with-email-and-otp"
            }
          ],
          "id": "auth-and-accounts.create-account"
        }
      ],
      "id": "auth-and-accounts",
      "storyCount": 5
    },
    {
      "name": "Notes",
      "provenance": "founder",
      "features": [
        {
          "name": "Note CRUD",
          "stories": [
            {
              "name": "Create a note",
              "priority": "must",
              "release": "MVP",
              "provenance": "founder",
              "id": "notes.note-crud.create-a-note"
            },
            {
              "name": "Edit a note",
              "priority": "must",
              "release": "MVP",
              "provenance": "founder",
              "id": "notes.note-crud.edit-a-note"
            },
            {
              "name": "Delete a note forever",
              "priority": "must",
              "release": "MVP",
              "provenance": "founder",
              "id": "notes.note-crud.delete-a-note-forever"
            }
          ],
          "id": "notes.note-crud"
        },
        {
          "name": "Pin notes",
          "stories": [
            {
              "name": "Pin a note to the top of the inbox",
              "priority": "must",
              "release": "MVP",
              "provenance": "founder",
              "id": "notes.pin-notes.pin-a-note-to-the-top-of-the-inbox"
            },
            {
              "name": "Unpin a pinned note",
              "priority": "must",
              "release": "MVP",
              "provenance": "founder",
              "id": "notes.pin-notes.unpin-a-pinned-note"
            }
          ],
          "id": "notes.pin-notes"
        },
        {
          "name": "Trash and restore",
          "stories": [
            {
              "name": "Trash a note",
              "priority": "must",
              "release": "MVP",
              "provenance": "founder",
              "id": "notes.trash-and-restore.trash-a-note"
            },
            {
              "name": "Restore a trashed note",
              "priority": "must",
              "release": "MVP",
              "provenance": "founder",
              "id": "notes.trash-and-restore.restore-a-trashed-note"
            }
          ],
          "id": "notes.trash-and-restore"
        },
        {
          "name": "Folders",
          "stories": [
            {
              "name": "Create a folder",
              "priority": "must",
              "release": "MVP",
              "provenance": "founder",
              "id": "notes.folders.create-a-folder"
            },
            {
              "name": "Move a note into a folder",
              "priority": "must",
              "release": "MVP",
              "provenance": "founder",
              "id": "notes.folders.move-a-note-into-a-folder"
            },
            {
              "name": "Browse the notes in a folder",
              "priority": "must",
              "release": "MVP",
              "provenance": "founder",
              "id": "notes.folders.browse-the-notes-in-a-folder"
            }
          ],
          "id": "notes.folders"
        }
      ],
      "id": "notes",
      "storyCount": 10
    },
    {
      "name": "Search and attachments",
      "provenance": "founder",
      "features": [
        {
          "name": "Search",
          "stories": [
            {
              "name": "Search notes by text",
              "priority": "should",
              "release": "Next",
              "provenance": "founder",
              "id": "search-and-attachments.search.search-notes-by-text"
            },
            {
              "name": "Open a note from a search result",
              "priority": "should",
              "release": "Next",
              "provenance": "founder",
              "id": "search-and-attachments.search.open-a-note-from-a-search-result"
            }
          ],
          "id": "search-and-attachments.search"
        },
        {
          "name": "Media attachments",
          "stories": [
            {
              "name": "Attach a photo to a note",
              "priority": "should",
              "release": "Next",
              "provenance": "founder",
              "id": "search-and-attachments.media-attachments.attach-a-photo-to-a-note"
            },
            {
              "name": "Attach an audio recording to a note",
              "priority": "should",
              "release": "Next",
              "provenance": "founder",
              "id": "search-and-attachments.media-attachments.attach-an-audio-recording-to-a-note"
            },
            {
              "name": "Play back an audio attachment",
              "priority": "should",
              "release": "Next",
              "provenance": "founder",
              "id": "search-and-attachments.media-attachments.play-back-an-audio-attachment"
            }
          ],
          "id": "search-and-attachments.media-attachments"
        }
      ],
      "id": "search-and-attachments",
      "storyCount": 5
    },
    {
      "name": "Shell demos",
      "provenance": "founder",
      "features": [
        {
          "name": "Startup and unknown shells",
          "stories": [
            {
              "name": "Boot through the startup shell",
              "priority": "could",
              "release": "Later",
              "provenance": "founder",
              "id": "shell-demos.startup-and-unknown-shells.boot-through-the-startup-shell"
            },
            {
              "name": "Land on the unknown shell for a bad route",
              "priority": "could",
              "release": "Later",
              "provenance": "founder",
              "id": "shell-demos.startup-and-unknown-shells.land-on-the-unknown-shell-for-a-bad-route"
            }
          ],
          "id": "shell-demos.startup-and-unknown-shells"
        },
        {
          "name": "Home and application shells",
          "stories": [
            {
              "name": "Browse the home shell",
              "priority": "could",
              "release": "Later",
              "provenance": "founder",
              "id": "shell-demos.home-and-application-shells.browse-the-home-shell"
            },
            {
              "name": "Browse the application shell",
              "priority": "could",
              "release": "Later",
              "provenance": "founder",
              "id": "shell-demos.home-and-application-shells.browse-the-application-shell"
            }
          ],
          "id": "shell-demos.home-and-application-shells"
        }
      ],
      "id": "shell-demos",
      "storyCount": 4
    },
    {
      "name": "Profile and gallery demos",
      "provenance": "founder",
      "features": [
        {
          "name": "Profile",
          "stories": [
            {
              "name": "View the profile surface",
              "priority": "could",
              "release": "Later",
              "provenance": "founder",
              "id": "profile-and-gallery-demos.profile.view-the-profile-surface"
            }
          ],
          "id": "profile-and-gallery-demos.profile"
        },
        {
          "name": "Gallery",
          "stories": [
            {
              "name": "Browse the components gallery",
              "priority": "could",
              "release": "Later",
              "provenance": "founder",
              "id": "profile-and-gallery-demos.gallery.browse-the-components-gallery"
            },
            {
              "name": "View the maps demo",
              "priority": "could",
              "release": "Later",
              "provenance": "founder",
              "id": "profile-and-gallery-demos.gallery.view-the-maps-demo"
            },
            {
              "name": "View the motion demo",
              "priority": "could",
              "release": "Later",